{
	"concern": "tab-session",
	"workflow": "W1",
	"generated_at": "2026-10-29T05:10:00Z",
	"summary": "NoMissingSession, KeepsSession and NeverAnother hold for the current SidecarManager within 1-2 stored sessions, 3-5 new ids and 4-6 spawns (2,925 and 61,683 states). The code before a10eb6877 breaks KeepsSession in 3 steps (a restart that names no session drops a written session); a10eb6877 as committed breaks NeverAnother in 5 steps (F1: a crash between ready and the get_state answer leaves the next spawn to autoResume). F1 was reproduced as a failing test and fixed.",
	"scope": {
		"modeled": [
			"sessionOpen and #spawn",
			"ready",
			"the ready status's get_state answer",
			"crash restart",
			"restart with no session, a stored session, another folder",
			"stock writing a session and its autoResume (environment)"
		],
		"abstracted": [
			"one tab, one folder",
			"the pool's view of the session is the ghost `shown`",
			"an omp update's restart is Restart"
		],
		"out_of_scope": [
			"session ownership wait",
			"start gate",
			"new_session/switch_session inside a running omp",
			"remote tabs",
			"extensions and settings of a spawn"
		],
		"assumptions": [
			"A1: start()'s awaits do not change #sessionPath or #isNew",
			"A2: get_state names the session the running omp is on",
			"A3: autoResume picks only a written session of the folder",
			"A4: the pool's sessionFile equals #sessionPath after the same get_state"
		]
	},
	"properties": [
		{
			"name": "NoMissingSession",
			"kind": "invariant",
			"statement": "NoMissingSession == lastOpen.k = \"session\" => lastOpen.f \\in written",
			"meaning": "--session never names a file stock has not written.",
			"source": "formal/tab-session/Properties.md",
			"frozen": true,
			"result": "holds",
			"tool": "TLC2 2026.10.28.014557",
			"bounds": "Stored={s1}, Others={s2}, NewIds={n1,n2,n3}, MaxSpawns=4; larger: Stored={s1,s3}, NewIds={n1..n5}, MaxSpawns=6",
			"evidence": "formal/tab-session/evidence/tlc-matrix.log"
		},
		{
			"name": "KeepsSession",
			"kind": "invariant",
			"statement": "KeepsSession == (proc = \"booting\" /\\ shown # NoS /\\ shown \\in written) => onOmp = shown",
			"meaning": "Every spawn of a tab whose session stock has written opens that session.",
			"source": "formal/tab-session/Properties.md",
			"frozen": true,
			"result": "holds",
			"tool": "TLC2 2026.10.28.014557",
			"bounds": "Stored={s1}, Others={s2}, NewIds={n1,n2,n3}, MaxSpawns=4; larger: Stored={s1,s3}, NewIds={n1..n5}, MaxSpawns=6",
			"evidence": "formal/tab-session/evidence/tlc-matrix.log"
		},
		{
			"name": "NeverAnother",
			"kind": "invariant",
			"statement": "NeverAnother == (proc = \"booting\" /\\ ~moved) => onOmp \\in {shown} \\cup NewIds",
			"meaning": "No spawn puts the tab on another written session than the one it shows, unless the person moved it.",
			"source": "formal/tab-session/Properties.md",
			"frozen": true,
			"result": "holds",
			"tool": "TLC2 2026.10.28.014557",
			"bounds": "Stored={s1}, Others={s2}, NewIds={n1,n2,n3}, MaxSpawns=4; larger: Stored={s1,s3}, NewIds={n1..n5}, MaxSpawns=6",
			"evidence": "formal/tab-session/evidence/tlc-matrix.log"
		},
		{
			"name": "KeepsSession (code before a10eb6877)",
			"kind": "invariant",
			"statement": "KeepsSession == (proc = \"booting\" /\\ shown # NoS /\\ shown \\in written) => onOmp = shown",
			"meaning": "OldCode=TRUE: the session path was cleared at ready and by a restart naming none; must fail.",
			"result": "violated",
			"tool": "TLC2 2026.10.28.014557",
			"bounds": "MC_old.cfg",
			"evidence": "formal/tab-session/evidence/tlc-matrix.log"
		}
	],
	"findings": [
		{
			"id": "F1",
			"title": "A new tab whose omp crashed before naming its session could come back on another conversation",
			"severity": "low",
			"status": "fixed",
			"property": "NeverAnother",
			"story": "A new tab starts: its omp boots on a new session (n1). The ready frame clears #isNew (a10eb6877 did it in #handleReady). The omp crashes before the ready status's get_state answer reaches #observeResponse, so #sessionPath is still empty. The crash restart's sessionOpen then sees no session and a tab that is not new, and passes neither --session nor --config fresh-launch.yml: with the person's autoResume on, stock reopens the folder's most recent session (s1) in the tab that showed a new one. Fix: #isNew is cleared where get_state names the session, not at ready.",
			"trace": [
				{
					"step": 1,
					"action": "Init",
					"changed": {
						"proc": "\"none\"",
						"isNew": "TRUE",
						"moved": "FALSE",
						"lastOpen": "[k |-> \"none\"]",
						"shown": "\"none\"",
						"used": "{}",
						"path": "\"none\"",
						"written": "{\"s1\", \"s2\"}",
						"onOmp": "\"none\"",
						"spawns": "0"
					}
				},
				{
					"step": 2,
					"action": "Spawn",
					"code": "src/main/sidecar.ts:636-650",
					"changed": {
						"proc": "\"none\" -> \"booting\"",
						"lastOpen": "[k |-> \"none\"] -> [k |-> \"new\"]",
						"used": "{} -> {\"n1\"}",
						"onOmp": "\"none\" -> \"n1\"",
						"spawns": "0 -> 1"
					}
				},
				{
					"step": 3,
					"action": "Ready",
					"code": "src/main/sidecar.ts:932-937",
					"changed": {
						"proc": "\"booting\" -> \"ready\"",
						"isNew": "TRUE -> FALSE"
					}
				},
				{
					"step": 4,
					"action": "Crash",
					"code": "src/main/sidecar.ts:755-779",
					"changed": {
						"proc": "\"ready\" -> \"none\"",
						"onOmp": "\"n1\" -> \"none\""
					}
				},
				{
					"step": 5,
					"action": "Spawn",
					"code": "src/main/sidecar.ts:636-650",
					"changed": {
						"proc": "\"none\" -> \"booting\"",
						"lastOpen": "[k |-> \"new\"] -> [k |-> \"default\"]",
						"onOmp": "\"none\" -> \"s1\"",
						"spawns": "1 -> 2"
					},
					"violation": true
				}
			],
			"reproduction": {
				"test": "src/main/session-launch-parity.test.ts::a new tab whose omp crashed before it named its session starts a new one, never another session",
				"result_before_fix": "fails",
				"result_after_fix": "passes"
			}
		}
	]
}